<?xml version="1.0"?>
<!DOCTYPE attd SYSTEM "class.dtd">
<classlist xmlns:xsi="http://www.w3.org/2001/XMLSchema-instance"
xsi:noNamespaceSchemaLocation="class.xsd">
    <class>
       <ClassId>C1 </ClassId >
	   <UserName>valli@yahoo.com   </UserName>
	   <Name>CSE   </Name>
    </class>
    <class>
       <ClassId>C2 </ClassId >
	   <UserName> abc@yahoo.com </UserName>
	   <Name>EEE   </Name>
    </class>
	<class>
       <ClassId>C3 </ClassId >
	   <UserName>atoz@gmail.com  </UserName>
	   <Name>Civil   </Name>
    </class>
	<class>
       <ClassId>C1 </ClassId >
	   <UserName>valli@yahoo.com   </UserName>
	   <Name>CSE   </Name>
    </class>
 </classlist>
 